TID,EN,AR,CN,CNT,DE,ES,FI,FR,HE,ID,IT,JP,KR,MS,NL,PL,PT,RU,TH,TR,VI
TID_WEAPON_THROWER_DESC,"A former factory hand, Sam Bronson has a vendetta against ALL robots.\n\nHe's the brawn behind the brains of the Goldarm Gang, always happy to take the loot and give robots the boot!",سام برونسون عامل سابق في مصنع، لديه ثأر ضد جميع الروبوتات.\n\nويمثل العضلات التي تواجه عقول عصابة الترسانة الذهبية، ويسعد دائمًا بالاستيلاء على الغنيمة دون أن يخلف شيئًا للروبوتات!,山姆·布朗森以前是一名工厂职工，他对机器人恨之入骨！\n\n这个大块头是金臂帮智囊团的坚实后盾，爱好有两样：拳夺战利品，脚踢机器人！,山姆布朗森以前是一名工廠老手，他對機器人恨之入骨！\n\n他是荒漠金臂幫的主力戰將，興趣是拳奪戰利品，腳踢機器人！,Als ehemaliger Fabrikarbeiter ist Sam Bronson auf einem Rachefeldzug gegen ALLE Roboter.\n\nEr ist der Schläger der Goldarm-Gang. Sam holt sich gern Beute und verbeult die Roboter-Meute!,"Sam Bronson trabajaba en la fábrica, y ahora quiere vengarse de todos los robots.\n\nSam es el musculitos de La banda del brazo de oro. Siempre está dispuesto a patear robots y a embolsarse los botines.","Entisenä tehdastyöntekijänä Sam Bronson janoaa kostoa kaikille roboteille.\n\nKultakäden koplassa hän edustaa raakaa voimaa ja suostuu milloin vain ryöstökeikalle, jos siellä pääsee romuttamaan robotteja!","Ancien ouvrier de la fabrique de robots, Sam Bronson les déteste de tout son être.\n\nDans le gang du bras d'or, il est là pour agir, pas pour réfléchir. Et il ne se fait jamais prier pour aller botter les fesses à un robot !","סאם ברונסון, עובד מפעל לשעבר, רוצה לנקום בכל הרובוטים.\n\nהוא הכוח מאחורי המוח של חבורת זרוע הזהב, ותמיד שמח לקחת את השלל ולהכניס מכות לרובוטים!",Si mantan pekerja pabrik Sam Bronson punya dendam kepada SEMUA robot.\n\nDia adalah pendiri dan otak di balik Geng Senjata Emas yang akan merampok dan menghancurkan para robot!,"Sam Bronson è un ex operaio che ha giurato vendetta contro TUTTI i robot. Nella banda di Bracciodoro, è quello che ti mena prima di fare domande ed è sempre pronto a rubare del bottino, soprattutto se c'è da fare a pezzi qualche testa di latta.",かつて工場労働者だったサム・ブロンソンは、あらゆるロボットを憎んでいる。今やゴールドアーム ギャングきっての武闘派である彼は、自らの拳でロボットへの怨みを晴らしながら、喜々としてお宝を略奪する！,"한때 공장 노동자였던 샘 브론슨은 로봇이라면 치를 떱니다.\n\n골드암 갱의 수뇌부를 지키는 근육맨으로, 로봇들을 박살내며 약탈을 즐깁니다!",Sam Bronson ialah bekas pekerja kilang yang menaruh dendam terhadap SEMUA robot.\n\nDialah ketua dan kekuatan Geng Senjata Emas yang seronok merampas dan menghancurkan robot!,Als voormalige fabriekswerker heeft Sam Bronson een vete tegen ALLE robots.\n\nHij is de spierkracht achter de bende van de gouden arm en eist met plezier de buit op nadat hij robots ervan langs geeft!,"Sam Bronson to były pracownik fabryki, który toczy wendettę przeciwko WSZYSTKIM robotom.\n\nWalczy w Gangu Złotorękiego. Uwielbia łupić i spuszczać robotom łomot!","Após se tornar obsoleto, o ex-operário Sam Bronson passou a odiar TODOS os robôs.\n\nEle é a força bruta por trás da Gangue do Braço Dourado, sempre contente ao destruir robôs e acumular ouro!","Бывший фабричный рабочий Сэм Бронсон ненавидит всех роботов без исключения.\n\nОн отвечает за грубую силу в банде Золотой Руки, падок на добычу и всегда готов навалять роботам.",อดีตพนักงานโรงงาน แซม บรอนสันมีความแค้นต่อหุ่นยนต์ทุกประเภท\n\nเขาคือจอมพลังสมองทึบของแก๊งแขนทองคำ ผู้เปรมปรีดิ์กับการปล้นและอัดหุ่นยนต์ให้ยับ!,"Eski bir fabrika işçisi olan Sam Bronson, tüm robotlara büyük bir kin besler.\n\nAltın Kol Çetesinin kas gücü olarak altınları aşırmaktan, robotları ise yumruklamaktan mutluluk duyar!","Một công nhân nhà máy đã về hưu, Sam Bronson không có thiện cảm với TẤT CẢ các thể loại robot.\n\nÔng ấy đảm nhiệm vai trò võ chiến trong Băng Cánh Tay Vàng, luôn sẵn sàng xông pha và xử lý bọn robot!"
TID_ACCESSORY_SOUL_COLLECTOR_GADGET_1_DESC,"Explode all uncollected spirits, dealing <c00cc00><VALUE1></c> damage to nearby enemies.",فجر كل الأرواح التي لم يتم جمعها لإلحاق <c00cc00><VALUE1></c> من الضرر بالأعداء القريبين.,引爆所有未收集的灵体，爆炸可对附近的敌人造成<c00cc00><VALUE1></c>伤害。,引爆所有未收集的靈體，爆炸可對附近的敵人造成<c00cc00><VALUE1></c>傷害。,Lässt alle nicht eingesammelten Geister explodieren und fügt damit Gegnern in der Nähe <c00cc00><VALUE1></c> Schaden zu.,Todos los espíritus que no han sido recolectados explotan e infligen <c00cc00><VALUE1></c> puntos de daño a los enemigos cercanos.,"Räjäytä kaikki keräämättömät henget, niin lähellä olevat vastustajat kärsivät <c00cc00><VALUE1></c> pistettä tuhoa.","Tous les esprits présents sur la carte explosent, infligeant <c00cc00><VALUE1></c> points de dégâts aux ennemis à proximité.","מפוצץ את כל הרוחות שלא נאספו, ומסב <c00cc00><VALUE1></c> נזק לאויבים סמוכים.",Semua roh yang belum diambil akan meledak dan memberikan <c00cc00><VALUE1></c> kerusakan ke lawan yang berada di dekatnya.,"Tutti gli spiriti che fluttuano sul campo di battaglia esplodono, causando <c00cc00><VALUE1></c> punti danno ai nemici vicini.",回収していないゴーストをすべて破裂させて、近くにいる敵に<c00cc00><VALUE1></c>ダメージを与える。,수집되지 않은 유령을 모두 터뜨려 주변의 적에게 <c00cc00><VALUE1></c>의 피해를 줍니다.,"Meletupkan semua roh yang tidak dikumpul, melakukan <c00cc00><VALUE1></c> kerosakan terhadap musuh berdekatan.","Gus laat alle niet-verzamelde geesten ontploffen, waarmee hij <c00cc00><VALUE1></c> schade aanricht aan nabije vijanden.","Wysadź w powietrze wszystkie niezebrane duchy, zadając <c00cc00><VALUE1></c> pkt. obrażeń pobliskim wrogom.","Explode todos os fantasmas materializados, causando <c00cc00><VALUE1></c> pontos de dano a inimigos próximos.","Все несобранные призраки взрываются, нанося <c00cc00><VALUE1></c> ед. урона. врагам поблизости.",ระเบิดดวงวิญญาณทั้งหมดที่ไม่ได้เก็บ สร้างความเสียหาย <c00cc00><VALUE1></c> หน่วยให้กับศัตรูที่อยู่ใกล้เคียง,Toplanmayan tüm ruhları patlatarak yakınlarındaki düşmanlara <c00cc00><VALUE1></c> hasar verir.,Tất cả những linh hồn chưa được thu thập sẽ nổ tung và gây <c00cc00><VALUE1></c> sát thương cho kẻ địch ở gần đó.
TID_ACCESSORY_BLOCKED_MISSING_SOULS,Missing spirits!,الأرواح غير متاحة!,没有灵体！,沒有靈體！,Es fehlen Geister!,¡Faltan espíritus!,Tarvitaan enemmän henkiä!,Aucun esprit présent !,רוחות חסרות!,Tidak ada roh!,Non ci sono spiriti!,ゴーストがいません！,유령이 없습니다!,Tiada roh!,Geen geesten!,Brakuje duchów!,Nenhum fantasma foi materializado!,Не хватает призраков!,ขาดดวงวิญญาณ!,Ruh yok!,Không có linh hồn nào!
TID_ACCESSORY_BLOCKED_SPIRIT_ALREADY_FULL,Spirit already full!,شريط الروح مكتمل بالفعل!,已完成灵体充能！,已完成靈體蓄能！,Geisterleiste bereits voll!,¡El espíritu está completo!,Henki on jo täynnä!,Un esprit est déjà prêt !,רמת הרוח כבר מלאה!,Roh penuh!,Indicatore dello spirito al massimo!,ゴーストのゲージが満タンです！,영혼치가 이미 최대입니다!,Roh sudah penuh!,Geestdrift is al vol!,Wskaźnik ducha jest pełny!,A barra de criação de fantasmas já está cheia!,Призрачная шкала уже заполнена!,ดวงวิญญาณเต็มอยู่แล้ว!,Ruh zaten dolu!,Thanh linh hồn đã đầy!
TID_SKIN_INFO_OUTLAW,Calamity Gang skin,مظهر عصابة الكوارث,劫难战团皮肤,浩劫災星幫造型,Chaos-Gang-Skin,Aspecto de La banda de la calamidad,Katalan koplan asu,Skin du gang des calamités,סקין חבורת האסון,Kostum Geng Mara Bahaya,Skin della Calamity Gang,カラミティギャングスキン,컬래미티 갱 스킨,Kulit Geng Gempar,Skin van de onheilsbende,Przebranie Koszmarnego Gangu,Visual da Gangue do Caos,Скин «Головорезы»,สกินแก๊งหายนะ,Felaket çetesi kostümü,Trang phục Băng Bất Hảo
TID_HINT_45,Make sure to use a Creator Code in the Shop.,احرص على استخدام رمز منشئ المحتوى في المتجر.,记得在商店中使用创作者代码。,記得在商店中使用創作者代碼。,"Denk daran, einen Creator-Code im Shop zu verwenden.",Asegúrate de usar el código del creador en la tienda.,Muista käyttää kaupassa sisällöntuottajan koodia.,Utilisez un code de créateur dans le magasin.,יש להקפיד להשתמש בקוד היוצר בחנות.,Pastikan untuk menggunakan Kode Kreator di Toko.,Non dimenticarti di usare un codice del creatore nel negozio.,ショップで忘れずにクリエイターコードを使いましょう。,상점에서 꼭 크리에이터 코드를 사용하세요.,Pastikan anda menggunakan kod pencipta di kedai.,Gebruik zeker een contentmakerscode in de winkel.,"Pamiętaj, aby użyć kodu twórcy w sklepie.",Use o código de criador na loja.,Не забывай вводить код автора в магазине.,อย่าลืมใช้รหัสผู้สร้างคอนเทนต์ในร้านค้า,Dükkanda içerik üreticisi kodu kullanmayı unutma.,Đừng quên dùng Mã nhà sáng tạo nội dung trong Cửa hàng nhé!
TID_HINT_48,Use Pins and Sprays in-game to express your emotions.,استخدم التعبيرات والبخاخات داخل اللعبة للتعبير عن مشاعرك.,在对战中使用表情和喷漆表达自己。,在對戰中使用表情和噴漆展現自我。,"Zeig mit Pins und Sprays, wie du dich fühlst.",Utiliza reacciones y sprays en el juego para expresar lo que sientes.,Ilmaise itseäsi pelissä merkeillä ja sprayilla!,Utilisez des émoticônes et des sprays pour vous exprimer pendant les combats.,מומלץ להשתמש בסיכות ובתרסיסים במהלך המשחק כדי להביע רגשות.,Gunakan Pin dan Cat untuk menunjukkan perasaanmu dalam game.,Esprimi le tue emozioni in gioco con reazioni e graffiti.,ゲーム中は、ピンズやスプレーを使って感情を表現しましょう。,게임 중에 핀과 스프레이를 써서 기분을 표현하세요.,Guna pin dan semburan dalam permainan untuk menunjukkan emosi anda.,Gebruik reacties en sprays om je uit te drukken tijdens gevechten.,"Używaj odznak i sprejów w grze, aby wyrazić emocje.",Use reações e sprays no jogo para se expressar.,"Используй значки и спреи, чтобы выражать настроение в игре.",ใช้อีโมจิและสเปรย์ในเกมเพื่อแสดงอารมณ์ของคุณ,Oyun içinde rozetler ve spreylerle kendini ifade edebilirsin.,Dùng Huy hiệu và Sơn xịt trong trò chơi để thể hiện cảm xúc.
TID_HINT_53,"When you're holding the most gems in Gem Grab, prioritize defending over attacking.",عندما تتحصل على أكبر عدد من الجواهر في جمع الجواهر، امنح الأولوية للدفاع على الهجوم.,在宝石争霸模式中，如果您持有的宝石数最多，最好优先考虑防守而不是进攻。,在寶石爭奪戰中，如果你持有的寶石數最多，最好優先考慮防守而不是進攻。,"Wenn du die meisten Juwelen bei der Juwelenjagd hast, solltest du dich auf die Verteidigung konzentrieren.","En Atrapagemas, cuando eres el que tiene más gemas, prioriza defender a atacar.","Kun sinulla on eniten jalokiviä jalokivikaappauksessa, keskity puolustamaan.","Quand c'est vous qui portez le plus de gemmes en mode Razzia de gemmes, privilégiez la défense à l'attaque.","כשמרוויחים הכי הרבה יהלומים בתופסים-יהלומים, צריך לתעדף הגנה על פני התקפה.","Saat kamu memegang Permata di Rebut Permata, fokuslah pada bertahan.","Quando hai un sacco di gemme con te in Arraffagemme, tieniti sulla difensiva.",エメラルドハントで最も多くのエメラルドを持っている時は、攻撃より防御を優先しましょう。,젬 그랩에서 보석을 가장 많이 가지고 있을 땐 공격보다 수비에 집중하세요.,Utamakan pertahanan daripada serangan apabila anda memegang paling banyak permata dalam Rebut Permata.,Focus op verdedigen wanneer je de meeste edelstenen bij je hebt in edelstenengraai.,"Kiedy masz najwięcej klejnotów w zbiorze klejnotów, za cel obierz sobie obronę, a nie atak.","Quando estiver com muitas gemas em Pique-gema, priorize a defesa em vez do ataque.","Набрав больше всего кристаллов в режиме «Захват кристаллов», старайся защищаться, а не атаковать.",เมื่อคุณถืออัญมณีไว้มากที่สุดในศึกชิงอัญมณี ให้เน้นที่การตั้งรับแทนการบุก,Elmas kapmaca sırasında en fazla elmas sizdeyse saldırı yerine savunmaya öncelik verin.,"Khi chơi Vơ vét Ngọc, bạn nên ưu tiên phòng thủ nếu đang là người sở hữu nhiều ngọc nhất."
TID_HINT_59,"Always watch out for Bo's mines, they could be anywhere!",احترس دائمًا من ألغام بو، فقد توجد في أي مكان!,一定要当心阿渤的地雷，它们无处不在！,一定要小心鷹獵人爆的地雷，它們無所不在！,Hüte dich stets vor Bos Minen! Sie könnten überall sein!,"Recuerda prestar siempre atención a las minas de Bo, ¡pueden estar en cualquier lado!","Bo voi piilottaa miinoja minne vain, joten ole varuillasi!","Faites attention aux mines de Bo, elles peuvent être n'importe où !",תמיד צריך להיזהר מהמוקשים של בו. הם עלולים לצוץ בכל מקום!,Ranjau milik Bo bisa berada di mana-mana! Berhati-hatilah!,"Fa' sempre attenzione alle mine di Bo, possono essere ovunque!",ボウの地雷はどこに埋まっているか分かりません。常に注意しましょう！,보의 폭발 덫이 어디에 도사리고 있을지 모르니 항상 조심하세요!,"Sentiasa berhati-hati dengan periuk api Bo, ia boleh ada di mana-mana saja!",Pas op voor de mijnen van Bo: ze kunnen overal liggen!,Zawsze wypatruj min Bo - mogą być wszędzie!,Cuidado com as minas do Bo. Elas podem estar em qualquer lugar!,"Берегись ловушек Бо, они могут быть где угодно!",คอยระวังกับดักระเบิดของโบไว้ให้ดี มันอาจซ่อนอยู่ตรงไหนก็ได้!,"Bo'nun mayınlarına dikkat et, nereden çıkacakları belli olmaz!","Luôn cảnh giác với mìn của Bo, chúng có thể ở bất cứ đâu đấy!"
TID_EMOTE_BUNDLE_OUTLAW_PACK,Calamity Gang Pin pack,باقة تعبير عصابة الكوارث,劫难战团表情礼包,浩劫災星幫表情特惠包,Chaos-Gang-Pinpaket,Lote de reacciones de La banda de la calamidad,Katalan koplan merkkipaketti,Pack d´émoticônes du gang des calamités,חבילת סיכות של חבורת האסון,Paket Pin Geng Mara Bahaya,Pacc. reazioni della Calamity Gang,カラミティギャングピンズパック,컬래미티 갱 핀 팩,Pek Pin Geng Gempar,Reactiepakket van de onheilsbende,Pakiet odznak Koszmarnego Gangu,Pacote de reações da Gangue do Caos,Набор значков «Головорезы»,แพ็คอีโมจิแก๊งหายนะ,Felaket çetesi rozet paketi,Gói Huy hiệu Băng Bất Hảo
TID_SHOP_OUTLAW_SKINS,Calamity Gang skin,مظهر عصابة الكوارث,劫难战团皮肤,浩劫災星幫造型,Chaos-Gang-Skin,Aspecto de La banda de la calamidad,Katalan koplan asu,Skin du gang des calamités,סקין חבורת האסון,Kostum Geng Mara Bahaya,Skin della Calamity Gang,カラミティギャングスキン,컬래미티 갱 스킨,Kulit Geng Gempar,Skin van de onheilsbende,Przebranie Koszmarnego Gangu,Visual da Gangue do Caos,Скин «Головорезы»,สกินแก๊งหายนะ,Felaket çetesi kostümü,Trang phục Băng Bất Hảo
TID_GEAR_RARITY_RARE,Super Rare,بالغ الندرة,超稀有,超稀有,Superselten,Superespecial,Superharvinainen,Super rare,נדיר במיוחד,Super Langka,Super raro,スーパーレア,초희귀,Superjarang,Superzeldzaam,Bardzo rzadkie,Super-rara,Сверхредкое,ซูเปอร์แรร์,Süper Ender,Siêu Hiếm
TID_GEAR_RARITY_SUPER_RARE,Epic,استثنائي,史诗,史詩,Episch,Épico,Eeppinen,Épique,אדיר,Epik,Epico,ハイパーレア,영웅,Epik,Episch,Epickie,Épica,Эпическое,อีปิค,Destansı,Quý hiếm
TID_GEAR_RARITY_EPIC,Mythic,خرافي,神话,神話,Mythisch,Mítico,Myyttinen,Mythique,מדהים,Mistis,Mitico,ウルトラレア,신화,Mitos,Mythisch,Mityczne,Mítica,Мифическое,มีธิค,Gizemli,Thần thoại
TID_TRY_BRAWLER_TITLE,Try Brawler,جرب البطل,试用英雄,試用英雄,Brawler ausprobieren,Probar brawler,Kokeile rämäpäätä,Essayer le brawler,נסו את הבראולר,Coba Jagoan,Prova il brawler!,キャラクターを試す,브롤러 체험하기,Cuba Brawler,Knokker uitproberen,Wypróbuj Zadymiarza,Testar Brawler,Испытать бойца,ลองใช้บรอว์เลอร์,Savaşçıyı Dene,Dùng thử Chiến binh Brawl
TID_TRY_BRAWLER_BUTTON_TRAINING_GROUNDS,TRAINING GROUNDS,أراضي التدريب,训练场,訓練場,TRAININGSPLATZ,TERRENOS DE PRÁCTICA,HARJOITTELUALUE,TERRAIN D'ENTRAÎNEMENT,שטחי אימון,TEMPAT LATIHAN,CAMPO DI PROVA,訓練場,훈련장,TAPAK LATIHAN,OEFENTERREIN,ARENA TRENINGOWA,CAMPO DE TREINAMENTO,ТРЕНИРОВОЧНАЯ ПЛОЩАДКА,สนามฝึกซ้อม,EĞİTİM ALANI,THAO TRƯỜNG
TID_FIRST_GADGET_TUTORIAL_HEADER_DESC,An extra ability for your brawler,قدرة إضافية لبطلك,英雄的一项额外技能,英雄的一項額外技能,Eine zusätzliche Fähigkeit für deinen Brawler.,Una habilidad extra para tu brawler.,Lisäkyky rämäpäällesi,Capacité supplémentaire pour votre brawler,יכולת נוספת לבראולר שלך,Kemampuan ekstra untuk Jagoan,Un'abilità aggiuntiva per il brawler.,キャラクターに追加能力を付与,브롤러의 추가 능력,Keupayaan tambahan untuk brawler anda.,Een extra vaardigheid voor je knokker.,Dodatkowa zdolność dla twojego Zadymiarza,Uma habilidade extra para o seu Brawler.,Дополнительная способность для бойца,ความสามารถเสริมสำหรับบรอว์เลอร์ของคุณ,Savaşçın için ekstra yetenek,Một kỹ năng bổ sung cho chiến binh brawl của bạn
TID_FIRST_GADGET_TUTORIAL_1_DESC,All Brawlers unlock their Gadget slot at Power 7,يفتح كل الأبطال موضع الجهاز في مستوى القوة 7,英雄战力等级达到7级即可解锁随身妙具栏位,英雄戰力等級達到7級即可解鎖武裝配件欄位,Alle Brawler schalten ihren Gadgetslot auf Powerlevel 7 frei.,Los brawlers desbloquean su gadget con un nivel de fuerza 7.,Kaikkien rämäpäiden varustepaikka avautuu tehotasolla 7.,Le premier emplacement est débloqué au niveau 7 de pouvoir,כל הבראולרים מקבלים גישה למשבצת הגאדג‘טים שלהם ברמת כוח 7,Slot Gadget Jagoan terbuka di Level Kekuatan 7,I brawler sbloccano lo slot dei gadget al livello 7.,各キャラクターのガジェットスロットは、パワーレベル7でアンロックされます。,모든 브롤러는 파워 레벨 7에 가젯 슬롯을 잠금 해제합니다.,Semua brawler membuka slot pelengkap mereka pada kuasa 7.,Alle knokkers ontgrendelen hun vak voor gadgets op krachtlevel 7.,Wszyscy Zadymiarze odblokowują miejsce na gadżet po osiągnięciu 7. poziomu mocy,Os Brawlers liberam o espaço de engrenagem no nível de poder 7.,Гаджет каждого бойца открывается на 7-м уровне силы.,บรอว์เลอร์ทุกตัวจะปลดล็อคช่องอุปกรณ์เสริมที่เลเวลพลัง 7,Tüm savaşçıların aksesuar bölmesi 7. seviyede açılır,Tất cả Chiến binh Brawl sẽ mở khóa ô Phụ kiện của mình khi đạt Cấp Sức mạnh 7
TID_FIRST_GADGET_TUTORIAL_2_DESC,Unique Gadgets for every brawler,أجهزة فريدة لكل بطل,每个英雄都有自己独特的随身妙具,每個英雄都有自己專屬的武裝配件,Einzigartige Gadgets für jeden Brawler.,Cada brawler tiene gadgets únicos.,Jokaiselle rämäpäälle on omat varusteensa.,Des gadgets uniques pour chaque brawler,גאדג‘טים ייחודיים לכל בראולר,Gadget unik untuk setiap jagoan,Ognuno di loro ha dei gadget unici.,各キャラクターには専用ガジェットが存在します。,각 브롤러에게는 고유의 가젯이 있습니다.,Alat unik untuk setiap brawler.,Unieke gadgets voor elke knokker.,Wyjątkowe gadżety dla każdego Zadymiarza,Acessórios exclusivos para cada Brawler.,У каждого бойца есть свои уникальные гаджеты.,อุปกรณ์เสริมเฉพาะสำหรับบรอว์เลอร์ทุกตัว,Tüm savaşçılar için eşsiz aksesuarlar,Phụ kiện độc đáo cho mọi chiến binh brawl
TID_FIRST_GADGET_TUTORIAL_3_DESC,Use your equipped Gadget up to 3 times per match,استخدم الجهاز المحدد 3 مرات في المواجهة بحد أقصى,随身妙具每场对战最多使用3次,武裝配件每場對戰最多使用3次,Nutze dein ausgerüstetes Gadget bis zu 3-mal in einem Match.,Usa el gadget equipado hasta 3 veces por partida.,Voit käyttää aktivoitua varustetta enintään kolme kertaa ottelun aikana.,Utilisez votre gadget jusqu'à trois fois par match !,אפשר להשתמש בגאדג‘ט המצויד עד 3 פעמים במשחק,Gunakan Gadget yang dipilih hingga 3 kali per laga,Usa il gadget equipaggiato fino a tre volte in un combattimento.,装備したガジェットはマッチ中3回まで使用できます。,선택한 가젯은 매치당 최대 3번 사용할 수 있습니다.,Guna alat yang dilengkapkan sehingga 3 kali dalam setiap perlawanan.,Je kunt je gekozen gadget maximaal 3 keer per gevecht gebruiken.,Możesz użyć wyposażonego gadżetu do 3 razy na mecz,Use um acessório equipado até 3 vezes por batalha.,Выбранный гаджет можно использовать до 3 раз за матч.,ใช้อุปกรณ์เสริมที่คุณติดตั้งได้สูงสุด 3 ครั้งต่อแมตช์,Seçilen aksesuar maç başına 3 kez kullanılabilir,Sử dụng Phụ kiện đã trang bị tối đa 3 lần trong mỗi trận đấu
TID_FIRST_STARPOWER_TUTORIAL_HEADER_DESC,Unique passive abilities for your brawler,قدرات سلبية فريدة لبطلك,英雄独特的被动技能,英雄的專屬被動技能,Einzigartige passive Fähigkeiten für deinen Brawler.,Habilidades pasivas únicas para tu brawler.,Ainutlaatuisia passiivisia kykyjä rämäpäällesi,Capacités passives exclusives pour votre brawler,יכולות פסיביות ייחודיות לבראולר שלך,Kemampuan pasif unik untuk Jagoan,Abilità passive e uniche per il brawler.,キャラクターの専用パッシブスキル,브롤러를 위한 특별한 패시브 능력입니다.,Keupayaan pasif unik untuk brawler anda.,Unieke passieve vaardigheden voor je knokker.,Wyjątkowe pasywne zdolności dla twojego Zadymiarza,Habilidades passivas e exclusivas para o seu Brawler.,Уникальные пассивные способности бойцов,ความสามารถติดตัวเฉพาะสำหรับบรอว์เลอร์ของคุณ,Savaşçın için eşi olmayan pasif yetenekler,Các kỹ năng bị động độc đáo cho chiến binh brawl của bạn
