TID,EN,AR,CN,CNT,DE,ES,FI,FR,HE,ID,IT,JP,KR,MS,NL,PL,PT,RU,TH,TR,VI
TID_CROSS_BOMBER_WEAPON_DESC,"Grom hurls Bud, his exploding walkie-talkie! The blast moves in the shape of a cross, hurting enemies caught in its path.",يرمي جروم هاتفه اللاسلكي المتفجر! يتحرك الانفجار على شكل (+)، فيلحق ضررًا بكل الأعداء الموجودين في طريقه.,格罗姆扔出他的老伙计巴迪，一台会爆炸的对讲机！爆炸产生的冲击波会呈十字形扩散，对路径上的所有敌人造成伤害。,葛羅姆丟出會爆炸的對講機！爆炸會沿十字形擴散，對路徑上的所有敵人造成傷害。,"Grom wirft Bud, sein explodierendes Walkie-Talkie! Die Explosion ist kreuzförmig und schadet allen Gegnern in ihrem Wirkungsbereich.",¡Grom lanza su walkie-talkie explosivo! La explosión se expande en forma de cruz e inflige daño a los enemigos que se encuentren en su camino.,"Grom heittää räjähtävän radiopuhelimensa, Kamun, jonka räjähdys etenee X:n muodossa ja vahingoittaa tielleen osuvia vastustajia.","Grom lance Bud, son talkie-walkie explosif ! L'explosion se disperse dans une zone en forme de X, infligeant des dégâts à tous les ennemis sur son passage.","גרום זורק את באד, מכשיר הקשר המתפוצץ שלו! הפיצוץ נע בצורת צלב ומעיף אחורה כל יריב שנקרה בדרכו.","Grom melemparkan Bud, si walkie-talkie yang akan meledak! Ledakan tersebut akan menyebar dalam pola silang dan memberi kerusakan pada semua lawan yang ada di jalurnya.","Grom scaglia i suoi walkie-talkie, che creano un'esplosione a forma di croce e infliggono danni a tutti i nemici nell'area di impatto.",爆発するトランシーバーを投げると、十文字に燃え広がり、巻き込んだ敵キャラクターにダメージを与える。,폭발성 무전기인 버드를 던집니다! 무전기는 십자형으로 폭발하며 경로상에 있는 적에게 피해를 줍니다.,"Grom melemparkan walkie-talkienya, Bud yang meletup! Ia meletup dalam bentuk silang, mencederakan musuh yang terperangkap di laluannya.","Grom werpt Bud, zijn explosieve walkietalkie, waardoor een kruisvormige ontploffing ontstaat die alle geraakte vijanden beschadigt.","Grom rzuca Kolegą, czyli wybuchającą krótkofalówką, powodując eksplozję w kształcie krzyża, która razi wrogów w swoim zasięgu.",Grom arremessa seu fiel walkie-talkie! A explosão em forma de cruz causa dano em inimigos no caminho.,Гром атакует броском разрывной рации! Взрыв распространяется по крестообразной области и наносит урон всем врагам в зоне поражения.,กร็อมเหวี่ยงบั๊ด วิทยุสื่อสารระเบิดได้ของเขา! แรงระเบิดพุ่งเป็นรูปกากบาท ทำร้ายศัตรูที่อยู่ในเส้นทาง,"Grom, patlayan telsizini fırlatır. Telsiz düştüğü yerde artı şeklinde patlayıp yoluna çıkan düşmanlara hasar verir.","Grom ném ra chiếc bộ đàm phát nổ của mình, tạo ra vụ nổ theo hình chữ X, gây sát thương cho mọi đối thủ trong tầm."
TID_CROSS_BOMBER_ULTI_DESC,"Grom launches a devastating bomb with Bud's help! The Grom Bomb inflicts huge damage, breaks walls and the force from its blast pushes all enemies backwards.",يستعين جروم بهاتفه اللاسلكي لصنع انفجار هائل باستخدامه! تلحق قنبلة جروم ضررًا كبيرًا وتكسر الجدران، كما أن قوة انفجارها تدفع كل الأعداء إلى الوراء.,在巴迪的助力下，格罗姆发射一枚终极爆弹，可造成大量伤害，摧毁墙壁，冲击波还能击退敌人！,葛羅姆和巴弟並肩作戰，敵人無不聞風喪膽！他丟出的大十字炸彈可以造成大量傷害，破壞牆壁，衝擊波還能擊退敵人！,"Grom schleudert mit Buds Hilfe eine zerstörerische Bombe. Die Grombombe richtet großen Schaden an, zerstört Mauern und die Wucht der Explosion stößt Gegner zurück.","Grom lanza una bomba devastadora con la ayuda de su walkie-talkie. La gromba inflige un gran daño, rompe muros y la fuerza de la explosión hace retroceder a todos los enemigos.","Grom lähettää radiopuhelimestaan tuhoisan pommin! Gromin pommi aiheuttaa valtavasti tuhoa, murtaa muureja ja työntää kaikkia vastustajia taaksepäin.","Grom utilise Bud pour lancer une bombe dévastatrice, infligeant de lourds dégâts et détruisant les murs. L'onde de choc de l'explosion repousse tous les ennemis.","גרום משגר פצצה הרסנית באמצעות באד! פצצת הגרום גורמת נזק רב, שוברת קירות, והדף הפיצוץ שלה מעיף אחורה את כל האויבים.","Grom melemparkan bom penghancur dengan bantuan Bud! Bom Grom akan memberikan kerusakan besar, menghancurkan tembok, dan menimbulkan gelombang dahsyat yang menghantam mundur lawan.","Grom lancia una bomba collegata a un walkie-talkie che infligge danni ingenti, fa saltare le protezioni nelle vicinanze e crea un'onda d'urto in grado di sbalzare all'indietro tutti i nemici in zona.",通常攻撃に恐るべき巨大爆弾を加えて発射する。敵に大ダメージを与えてノックバックさせ、壁も木っ端みじんに破壊する。,"무전기 버드의 도움으로 거대 폭탄을 투척해 막대한 피해를 입히고 벽을 부수며, 그 폭발력으로 모든 적을 뒤로 밀쳐냅니다.","Grom melancarkan bom kemusnahan dengan bantuan Bud! Bom Grom melakukan kerosakan besar, memecahkan benteng dan daya letupannya menolak semua musuh ke belakang.","Grom gebruikt Bud om een verwoestende bom te lanceren. De Grombom kan enorme schade aanrichten, muren vernietigen en vijanden in de buurt terugduwen.","Grom wystrzeliwuje z pomocą Kolegi niszczycielską bombę. Bomba gromowa zadaje ogromne obrażenia, niszczy ściany i odrzuca wszystkich wrogów do tyłu.",Grom lança uma bomba devastadora com a ajuda de seu walkie-talkie. A bomba causa uma explosão espetacular que quebra paredes e empurra todos os inimigos para trás.,"Гром швыряет рацию, усиленную мощной гром-бомбой! Бомба наносит огромный урон и крушит стены, а её взрывная волна отбрасывает всех врагов.",กร็อมใช้บั๊ดสร้างระเบิดพลังทำลายล้างสูง! กร็อมบอมบ์จะทำความเสียหายมหาศาล ทำลายกำแพง และแรงระเบิดจะผลักศัตรูกระเด็นถอยหลังด้วย,"Grom, telsizini kullanarak kocaman bir bomba fırlatır. Bu bomba büyük bir hasar gücüne sahiptir. Duvarları yıkar ve düşmanları geri püskürtür.","Grom ném ra một quả bom hủy diệt với sự trợ giúp của chiếc bộ đàm. Quả Bom Grom gây ra sát thương cực lớn, có thể phá vỡ tường chắn và đẩy lùi mọi đối thủ!"
TID_SPEC_ABI_CROSS_BOMBER_1_DESC,"When Grom's Super is fully charged, he gains <c00cc00>+<VALUE1>%</c> faster movement speed!",عندما يمتلئ زخم جروم كليًا، تزداد سرعة تحركه بمقدار <c00cc00>+<VALUE1>%</c>.,在超级技能充能完毕的状态下，格罗姆的移动速度提升<c00cc00><VALUE1>%</c>！,葛羅姆的超級技能蓄能完畢的狀態下，他的移動速度會提升<c00cc00><VALUE1>%</c>！,"Wenn Groms Superskill voll aufgeladen ist, bewegt er sich <c00cc00><VALUE1> %</c> schneller!","Cuando el súper de Grom está totalmente cargado, ¡su velocidad de movimiento aumenta un <c00cc00><VALUE1> %</c>!","Kun Gromin supervoima on täysin latautunut, hän liikkuu <c00cc00><VALUE1> %</c> nopeammin!","Quand le super de Grom est chargé, sa vitesse de déplacement augmente de <c00cc00><VALUE1> %</c>.","כאשר הסופר של גרום מוטען במלואו, הוא זוכה לשיפור מהירות תנועה של <c00cc00>+<VALUE1>%</c>!","Saat kekuatan Super Grom terisi penuh, kecepatan gerakannya akan meningkat <c00cc00>+<VALUE1>%</c>!","Quando la super è carica, la velocità di movimento di Grom aumenta del <c00cc00><VALUE1>%</c>.",必殺技が完全にチャージされている間、移動速度が<c00cc00><VALUE1>％</c>上昇する。,"그롬의 특수 공격이 완전히 충전되면, 이동 속도가 <c00cc00>+<VALUE1>%</c> 빨라집니다!","Apabila Super Grom dicas sepenuhnya, kelajuan pergerakannya bertambah <c00cc00><VALUE1>%</c>!","Als Groms super volledig is opgeladen, gaat zijn bewegingssnelheid met <c00cc00><VALUE1>%</c> omhoog.",Po pełnym naładowaniu superataku Grom zyskuje <c00cc00>+<VALUE1>%</c> do szybkości ruchu!,"Quando o Super de Grom está totalmente carregado, sua velocidade de movimento fica <c00cc00><VALUE1>%</c> mais rápida!","Когда Супер Грома полностью заряжен, он движется на <c00cc00><VALUE1> %</c> быстрее!",เมื่อท่าไม้ตายของกร็อมชาร์จเต็มแล้ว เขาจะได้รับความเร็วในการเคลื่อนที่ <c00cc00>+<VALUE1>%</c>!,Grom'un süper saldırısı tam dolu olduğunda hareket hızı <c00cc00>%<VALUE1></c> artar.,"Khi sạc đầy Tuyệt chiêu, tốc độ di chuyển của Grom sẽ tăng thêm <c00cc00><VALUE1>%</c>!"
TID_HOMEPAGE_GUIDE_FIRST_GEAR_2,Choose your first Gear for FREE,اختر عتادك الأول مجانًا,免费获取您的首个强化装备,免費獲取你的首個強化裝置,Wähle deine erste Ausrüstung GRATIS.,Elige tu primer refuerzo gratis.,Valitse ensimmäinen tehostimesi ilmaiseksi!,Le premier équipement est gratuit !,לבחירתך פריט ציוד ראשון חינם,Pilih Buster pertama GRATIS,Scegli il tuo primo equipaggiamento GRATIS!,最初のギアを無料で選びましょう,첫 번째 기어를 무료로 선택하세요.,Pilih pelengkap pertama anda secara PERCUMA.,Kies GRATIS je eerste uitrusting!,Wybierz pierwsze wyposażenie ZA DARMO,Escolha sua primeira engrenagem de graça!,Выбери первое снаряжение БЕСПЛАТНО!,เลือกเครื่องมือชิ้นแรกได้ฟรี,İlk eşyanı ÜCRETSİZ olarak seç,Chọn Trang bị đầu tiên MIỄN PHÍ
TID_ITEMS_HUB_GUIDE_GADGET,You can choose and purchase unique Gadgets for <BRAWLER> here,يمكنك اختيار أجهزة فريدة وشراؤها لـ<BRAWLER> هنا,您可以在这里为<BRAWLER>选择和购买独特的随身妙具,你可以在這裡為<BRAWLER>挑選並購買專屬的武裝配件,Hier kannst du für <BRAWLER> einzigartige Gadgets auswählen und kaufen.,Aquí puedes elegir y comprar gadgets exclusivos para <BRAWLER>.,Täältä voit valita ja ostaa ainutlaatuisia varusteita rämäpäälle <BRAWLER>.,Vous pouvez choisir et acheter des gadgets uniques pour <BRAWLER> ici,כאן באפשרותך לבחור גאדג‘טים ייחודיים עבור <BRAWLER> ולרכוש אותם,Kamu bisa memilih dan membeli Gadget unik untuk <BRAWLER> di sini,Qui puoi scegliere e acquistare gadget unici per <BRAWLER>.,ここから<BRAWLER>の専用ガジェットを購入・選択できます,<BRAWLER> 브롤러를 위한 특별한 가젯을 선택해 구매할 수 있습니다.,Anda boleh pilih dan beli alat unik untuk <BRAWLER> di sini.,Je kunt hier unieke gadgets voor <BRAWLER> kiezen en kopen.,Tutaj możesz wybrać i kupić wyjątkowe gadżety dla Zadymiarza <BRAWLER>,Selecione e adquira acessórios exclusivos para <BRAWLER> aqui.,<BRAWLER>: здесь можно выбрать и приобрести уникальные гаджеты для этого бойца,คุณสามารถเลือกและซื้ออุปกรณ์เสริมเฉพาะสำหรับ <BRAWLER> ได้ที่นี่,"Burada, <BRAWLER> için eşsiz aksesuarlar satın alabilirsin",Bạn có thể chọn và mua các Phụ kiện độc đáo cho <BRAWLER> tại đây
TID_ITEMS_HUB_GUIDE_GADGET_TAB,Gadgets now available from here,الآن تتوفر الأجهزة من هنا,在此获取随身妙具,在此獲取武裝配件,Gadgets jetzt hier erhältlich.,Los gadgets están disponibles aquí.,Täältä saa nyt varusteita.,Les gadgets sont disponibles ici,גאדג‘טים זמינים עכשיו כאן,Gadget sekarang tersedia di sini,Ora i gadget sono disponibili da qui.,ここからガジェットを購入できます,가젯 여기서 구매 가능,Alat kini tersedia di sini.,Gadgets zijn nu vanaf hier beschikbaar.,Gadżety są teraz dostępne tutaj,Os acessórios estão disponíveis aqui.,Теперь здесь можно выбрать гаджет,สามารถซื้ออุปกรณ์เสริมได้จากที่นี่,Aksesuarlar artık burada,Phụ kiện hiện đã có ở đây
TID_ITEMS_HUB_GUIDE_STARPOWER,You can choose and purchase unique Star Powers for <BRAWLER> here,يمكنك اختيار قدرات خاصة فريدة وشراؤها لـ<BRAWLER> هنا,您可以在这里为<BRAWLER>选择和购买独特的星徽之力,你可以在這裡為<BRAWLER>挑選並購買專屬的能力之星,Hier kannst du für <BRAWLER> einzigartige Starpowers auswählen und kaufen.,Aquí puedes elegir y comprar habilidades estelares exclusivas para <BRAWLER>.,Täältä voit valita ja ostaa ainutlaatuisia tähtivoimia rämäpäälle <BRAWLER>.,Vous pouvez choisir et acheter des pouvoirs star uniques pour <BRAWLER> ici,כאן באפשרותך לבחור כוחות כוכב ייחודיים עבור <BRAWLER> ולרכוש אותם,Kamu bisa memilih dan membeli Kekuatan Bintang unik untuk <BRAWLER> di sini,Qui puoi scegliere e acquistare abilità stellari uniche per <BRAWLER>.,ここで<BRAWLER>の専用スターパワーを購入できます,<BRAWLER>브롤러를 위한 특별한 스타 파워를 선택해 구매할 수 있습니다.,Anda boleh pilih dan beli kuasa bintang unik untuk <BRAWLER> di sini.,Je kunt hier unieke sterrenkrachten voor <BRAWLER> kiezen en kopen.,Tutaj możesz wybrać i kupić wyjątkowe gwiezdne moce dla Zadymiarza <BRAWLER>,Selecione e adquira poderes de estrela exclusivos para <BRAWLER> aqui.,<BRAWLER>: здесь можно выбрать и приобрести уникальные звёздные силы для этого бойца,คุณสามารถเลือกและซื้อพลังดวงดาวเฉพาะสำหรับ <BRAWLER> ได้ที่นี่,"Burada, <BRAWLER> için eşsiz Yıldız Güçleri alabilirsin",Bạn có thể chọn và mua các Sức mạnh Sao độc đáo cho <BRAWLER> tại đây
TID_ITEMS_HUB_GUIDE_STARPOWER_TAB,Star Powers are now available here,الآن تتوفر القدرات الخاصة هنا,在此获取星徽之力,在此獲取能力之星,Starpowers sind jetzt hier erhältlich.,Las habilidades estelares están disponibles aquí.,Täältä saa nyt tähtivoimia.,Les pouvoirs star sont disponibles ici,כוחות כוכב זמינים עכשיו כאן,Kekuatan Bintang sekarang tersedia di sini,Ora le abilità stellari sono disponibili qui.,ここからスターパワーを購入できます,스타 파워 여기서 구매 가능,Kuasa bintang kini tersedia di sini.,Sterrenkrachten zijn nu hier beschikbaar.,Gwiezdne moce są teraz dostępne tutaj,Os poderes de estrela estão disponíveis aqui.,Теперь здесь можно выбрать звёздную силу,สามารถซื้อพลังดวงดาวได้จากที่นี่,Yıldız Güçleri artık burada,Sức mạnh Sao hiện đã có ở đây
TID_HEROSCREEN_GUIDE_FIRST_GADGET,Gadgets are now available here,الآن تتوفر الأجهزة هنا,在此获取随身妙具,在此獲取武裝配件,Gadgets sind jetzt hier erhältlich.,Los gadgets están disponibles aquí.,Täältä saa nyt varusteita.,Les gadgets sont disponibles ici,גאדג‘טים זמינים עכשיו כאן,Gadget sekarang tersedia di sini,Ora i gadget sono disponibili qui.,ここからガジェットを購入できます,가젯 여기서 구매 가능,Alat kini tersedia di sini.,Gadgets zijn nu hier beschikbaar.,Gadżety są teraz dostępne tutaj,Os acessórios estão disponíveis aqui.,Теперь здесь можно выбрать гаджет,สามารถซื้ออุปกรณ์เสริมได้จากที่นี่,Aksesuarlar artık burada,Phụ kiện hiện đã có ở đây
TID_HEROSCREEN_GUIDE_FIRST_STARPOWER,Star Powers are now available here,الآن تتوفر القدرات الخاصة هنا,在此获取星徽之力,在此獲取能力之星,Starpowers sind jetzt hier erhältlich.,Las habilidades estelares están disponibles aquí.,Täältä saa nyt tähtivoimia.,Les pouvoirs star sont disponibles ici,כוחות כוכב זמינים עכשיו כאן,Kekuatan Bintang sekarang tersedia di sini,Ora le abilità stellari sono disponibili qui.,ここからスターパワーを購入できます,스타 파워 여기서 구매 가능,Kuasa bintang kini tersedia di sini.,Sterrenkrachten zijn nu hier beschikbaar.,Gwiezdne moce są teraz dostępne tutaj,Os poderes de estrela estão disponíveis aqui.,Теперь здесь можно выбрать звёздную силу,สามารถซื้อพลังดวงดาวได้จากที่นี่,Yıldız Güçleri artık burada,Sức mạnh Sao hiện đã có ở đây
TID_FIRST_GEAR_TUTORIAL_TITLE_DESC,Unlocked!,تم الفتح!,已解锁！,已解鎖！,freigeschaltet!,Disponibles,avattu!,DÉBLOQUÉ !,קיבלת גישה!,Terbuka!,sbloccati!,アンロックしました！,잠금 해제!,Dibuka!,ontgrendeld!,Odblokowano!,Liberado!,Разблокировано!,ปลดล็อคแล้ว!,Açıldı!,Đã mở khóa!
TID_FIRST_GEAR_TUTORIAL_BUTTON_NEXT,LET'S GO!,البدء!,开始吧!,开始吧!,AB GEHT‘S!,ADELANTE,MENOKSI!,C'est parti !,קדימה!,AYO!,PROCEDI,OK,시작!,JOM!,GAAN!,DO DZIEŁA!,VAMOS LÁ!,ПОГНАЛИ!,ลุยเลย!,HAYDİ!,BẮT ĐẦU NÀO!
TID_HERO_INFO_GEAR_BLOCKED,Power up <HERONAME> with Gear! This Gear slot is available after reaching Power Level <LEVEL>.,قم بتقوية <HERONAME> باستخدام العتاد. موضع العتاد هذا متاح بعد بلوغ مستوى القوة <LEVEL>.,使用强化装备，让<HERONAME>变得更强！英雄战力等级达到<LEVEL>级后即可解锁该装备栏位。,使用強化裝置，為<HERONAME>增強戰力！該強化裝置欄位將在英雄升至戰力等級<LEVEL>後解鎖。,"Verstärke <HERONAME> mit Ausrüstung! Dieser Ausrüstungsslot ist verfügbar, nachdem Powerlevel <LEVEL> erreicht wurde.",¡Potencia a <HERONAME> con refuerzos! Este hueco para refuerzos está disponible tras alcanzar el nivel de fuerza <LEVEL>.,<HERONAME> saa lisäpotkua tehostimilla! Tämä tehostinpaikka avautuu tehotasolla <LEVEL>.,Améliorez <HERONAME> grâce à un équipement ! Cet emplacement est disponible après avoir atteint le niveau <LEVEL> de pouvoir.,משיגים שיפור של <HERONAME> בעזרת הציוד הזה! משבצת הציוד הזו זמינה כשמגיעים לרמת כוח <LEVEL>.,Tingkatkan kekuatan <HERONAME> dengan Buster! Slot Buster akan tersedia setelah mencapai Level Kekuatan <LEVEL>.,Potenzia <HERONAME> con gli equipaggiamenti! Questo slot è disponibile quando il brawler raggiunge il livello <LEVEL>.,<HERONAME>をギアでパワーアップしましょう！パワーレベル<LEVEL>に到達すると、このギアスロットが解放されます。,기어와 함께 <HERONAME> 파워 업! 파워 레벨 <LEVEL> 도달 후 기어 슬롯 이용 가능.,Memperkuat <HERONAME> dengan pelengkap! Slot pelengkap ini akan tersedia selepas mencapai tahap kuasa <LEVEL>.,Versterk <HERONAME> met uitrustingen! Dit uitrustingsvak wordt beschikbaar nadat je KRACHTLEVEL <LEVEL> bereikt.,Wzmocnij postać <HERONAME> wyposażeniem! To miejsce na wyposażenie jest dostępne po osiągnięciu <LEVEL> poziomu mocy.,Aprimore <HERONAME> com engrenagens! Este espaço de engrenagem ficará disponível com nível de poder <LEVEL>.,"<HERONAME> может стать сильнее, используя снаряжение! Эта ячейка станет доступна на <LEVEL>-м уровне силы.",เพิ่มพลังให้ <HERONAME> ด้วยเครื่องมือ! ช่องสำหรับเครื่องมือนี้จะใช้ได้หลังจากเลเวลพลัง <LEVEL>,"<HERONAME>, eşyalarla güçlendirilebilir! Bu eşya bölmesi <LEVEL>. seviyede açılır.",Tăng sức mạnh cho <HERONAME> bằng Trang bị! Ô Trang bị này sẽ mở khóa khi đạt Cấp Sức mạnh <LEVEL>.
