"TID","EN","AR","CN","CNT","DE","ES","FI","FR","HE","ID","IT","JP","KR","MS","NL","PL","PT","RU","TH","TR","VI"
"TID_LEAPER_GADGET_2_DESC","Mico's next jump has <c00cc00><VALUE1>%</c> longer range.","قفزة ميكو التالية لها مدى أبعد بنسبة <c00cc00><VALUE1>%</c>.","米科的下一次跳跃距离延长<c00cc00><VALUE1>%</c>。","米可的下一次跳躍距離延長<c00cc00><VALUE1>%</c>。","Die Reichweite von Micos nächstem Sprung ist um <c00cc00><VALUE1> %</c> erhöht.","El alcance del próximo salto de Mico es un <c00cc00><VALUE1> %</c> mayor.","Micon seuraavan hypyn kantama on <c00cc00><VALUE1> %</c> pidempi.","Le prochain bond de Mico a <c00cc00><VALUE1> %</c> de portée supplémentaire.","יש לקפיצה הבאה של מיקו טווח ארוך יותר של <c00cc00><VALUE1>%</c>.","Jangkauan lompatan Mico berikutnya menjadi <c00cc00><VALUE1>%</c> lebih jauh.","Il primo salto di Mico successivo all'attivazione del gadget copre una distanza del <c00cc00><VALUE1>%</c> più lunga.","次の通常攻撃の射程距離が<c00cc00><VALUE1>％</c>伸びる。","다음 점프 시 <c00cc00><VALUE1>%</c> 더 멀리 뜁니다.","Jarak lompatan Mico yang seterusnya adalah <c00cc00><VALUE1>%</c> lebih jauh.","Mico's volgende sprong heeft <c00cc00><VALUE1>%</c> meer bereik.","Następny skok Mico ma o <c00cc00><VALUE1>%</c> większy zasięg.","O próximo salto de Mico tem alcance <c00cc00><VALUE1>%</c> maior.","Дальность следующего прыжка Мико увеличится на <c00cc00><VALUE1> %</c>.","การกระโดดครั้งต่อไปของมิโก้มีระยะไกลขึ้น <c00cc00><VALUE1>%</c>","Mico, bir sonraki sıçrayışında <c00cc00>%<VALUE1></c> daha uzağa gider.","Cú nhảy tiếp theo của Mico có tầm xa hơn <c00cc00><VALUE1>%</c>."
"TID_LEAPER_OVERCHARGE","SOUND CHECK","التحقق من الصوت","高音炸麦","音浪衝擊","SOUNDCHECK","PRUEBA DE SONIDO","SOUND CHECK","EFFET LARSEN","בדיקת קול","TES 1 ... 2 ... TES TES ...","SA, SA, PROVA","サウンドウェーブ","사운드 체크","UJI BUNYI","SOUNDCHECK","KONTROLA DŹWIĘKU","CHECAGEM DE SOM","САУНДЧЕК","ทดสอบระบบเสียง","SES DALGASI","KIỂM TRA ÂM THANH"
"TID_LEAPER_OVERCHARGE_DESC","Mico's super also stuns nearby enemies after landing for <c00cc00><VALUE1></c> seconds.","يصعق زخم ميكو الأعداء في الجوار بعد الهبوط لمدة <c00cc00><VALUE1></c> ث.","米科的超级技能落地时，还会击晕附近的敌人<c00cc00><VALUE1></c>秒。","米可的超級技能落地時，還會擊暈附近的敵人<c00cc00><VALUE1></c>秒。","Nach der Landung lähmt Micos Superskill Gegner zusätzlich <c00cc00><VALUE1></c> Sekunden lang.","El súper de Mico aturde a los enemigos cercanos durante <c00cc00><VALUE1></c> segundos cuando aterriza.","Laskeuduttuaan Micon supervoima myös lamaannuttaa vastustajat <c00cc00><VALUE1></c> sekunniksi.","Le super de Mico immobilise également les ennemis à l'impact pendant <c00cc00><VALUE1></c> seconde(s).","תכונת הסופר של מיקו מהממת גם אויבים ליד לאחר נחיתה למשך <c00cc00><VALUE1></c> שניות.","Kekuatan Super milik Mico juga akan memberikan efek kejut pada lawan terdekat selama <c00cc00><VALUE1></c> detik saat mendarat.","L'atterraggio effettuato con la super permette anche a Mico di stordire i nemici nelle vicinanze per <c00cc00><VALUE1></c> secondi.","必殺技の着地時に、周囲の敵を<c00cc00><VALUE1></c>秒間気絶させる。","미코의 특수 공격이 착지 후 주변 적을 <c00cc00><VALUE1></c>초 동안 기절시킵니다.","Super Mico juga memegunkan musuh berdekatan selepas mendarat selama <c00cc00><VALUE1></c> saat.","Mico's super verdooft <c00cc00><VALUE1></c> seconden lang nabije vijanden nadat hij landt.","Superatak Mico dodatkowo ogłusza wrogów w pobliżu na <c00cc00><VALUE1></c> s.","O Super do Mico também atordoa inimigos próximos por <c00cc00><VALUE1></c> segundos depois da aterrissagem.","После приземления Супер Мико также оглушает ближайших врагов на <c00cc00><VALUE1></c> с.","ท่าไม้ตายของมิโก้สตันศัตรูที่อยู่ใกล้ๆ หลังจากเขากระโดดลงมาเป็นระยะเวลา <c00cc00><VALUE1></c> วินาที","Mico'nun süper saldırısı, yere düştüğünde yakınlardaki düşmanları <c00cc00><VALUE1></c> saniyeliğine sersemletir.","Sau khi Mico tiếp đất, tuyệt chiêu của cậu ta cũng sẽ khiến đối thủ xung quanh bị choáng trong <c00cc00><VALUE1></c> giây."
"TID_ATTACHER_GADGET_1_DESC","Hide in a cardboard box becoming invisible for <c00cc00><VALUE1></c> seconds. Charges the Super <c00cc00><VALUE2></c> faster while stationary.","اختبئ في صندوق من الكرتون لتصبح غير مرئي لمدة <c00cc00><VALUE1></c> ث. يشحن الزخم بمقدار <c00cc00><VALUE2></c> السرعة في أثناء الثبات.","凯特躲进纸箱里，隐身<c00cc00><VALUE1></c>秒。静止不动时，他的超级技能充能速度变快<c00cc00><VALUE2></c>。","凱特躲進紙箱裡，隱身<c00cc00><VALUE1></c>秒。在紙箱裡靜止不動時，他的超級技能蓄能速度提升<c00cc00><VALUE2></c>。","Kit versteckt sich in einem Pappkarton und wird <c00cc00><VALUE1></c> Sekunden lang unsichtbar. Sein Superskill wird <c00cc00><VALUE2></c> schneller aufgeladen, während er stillsteht.","Se esconde en una caja de cartón y se vuelve invisible durante <c00cc00><VALUE1></c> segundos. Carga el súper <c00cc00><VALUE2></c> veces más rápido mientras se mantiene inmóvil.","Kit piiloutuu pahvilaatikkoon ja muuttuu näkymättömäksi <c00cc00><VALUE1></c> sekunniksi. Super latautuu <c00cc00><VALUE2></c> nopeammin, kun Kit pysyy paikallaan.","Kit se cache dans une boîte en carton, devenant invisible pendant <c00cc00><VALUE1></c> seconde(s). Son super se recharge <c00cc00><VALUE2></c> plus vite tant qu'il reste immobile.","מסתתר בקופסת קרטון כדי להיות בלתי נראה למשך <c00cc00><VALUE1></c> שניות. טוען את תכונת הסופר <c00cc00><VALUE2></c> מהר יותר כשהוא לא זז.","Kit akan bersembunyi di kotak kardus agar tidak terdeteksi selama <c00cc00><VALUE1></c> detik. Kekuatan Super akan terisi <c00cc00><VALUE2></c> kali lebih cepat saat diam.","Si nasconde in una scatola di cartone e diventa invisibile per <c00cc00><VALUE1></c> secondi. Ricarica la super il <c00cc00><VALUE2></c> più in fretta da fermo.","段ボール箱に隠れて敵の視界から<c00cc00><VALUE1></c>秒間姿を消す。移動をやめると必殺技のチャージ速度が<c00cc00><VALUE2></c>上昇する。","종이 상자에 숨어 <c00cc00><VALUE1></c>초 동안 투명 모드가 됩니다. 이동하지 않을 때 특수 공격이 <c00cc00><VALUE2></c> 더 빨리 충전됩니다.","Bersembunyi di dalam kotak kadbod kini menjadi halimunan untuk <c00cc00><VALUE1></c>saat. Mengecas Super <c00cc00><VALUE2></c> lebih cepat apabila tidak bergerak.","Verstop je in een kartonnen doos en word <c00cc00><VALUE1></c> seconden lang onzichtbaar. De super wordt <c00cc00><VALUE2></c> sneller opgeladen wanneer je stilstaat.","Ukryj się w kartonie, stając się niewidzialnym na <c00cc00><VALUE1></c> s. Ładujesz superatak szybciej (<c00cc00><VALUE2></c>), gdy jesteś w bezruchu.","Entra em sua caixa de papelão e fica invisível por <c00cc00><VALUE1></c> segundos. O Super é carregado <c00cc00><VALUE2></c> vezes mais rápido enquanto ele não se move.","Кит прячется в картонной коробке, становясь невидимым на <c00cc00><VALUE1></c> с., и заряжает Супер на <c00cc00><VALUE2></c> быстрее, если не двигается.","ซ่อนในลังกระดาษและล่องหนเป็นเวลา <c00cc00><VALUE1></c> วินาที ชาร์จท่าไม้ตายเร็วขึ้น <c00cc00><VALUE2></c> เมื่ออยู่กับที่","Karton kutuya saklanıp <c00cc00><VALUE1></c> saniyeliğine görünmez olur. Hareket etmediğinde süper özelliği <c00cc00><VALUE2></c> daha hızlı dolar.","Trốn trong thùng các tông và tàng hình trong <c00cc00><VALUE1></c> giây. Sạc Tuyệt chiêu <c00cc00><VALUE2></c> nhanh hơn trong khi đứng yên."
"TID_CCTV_POCO_SKIN","CCTV POCO","بوكو من كاميرا المراقبة","星妙实录波克","監視器畫面","CCTV POCO","POCO SALA DE VIDEOVIGILANCIA","VALVONTAKAMERA-POCO","POCO\nVIDÉOSURVEILLANCE","פוקו במעגל סגור","POCO CCTV","POCHO CCTV","CCTV ポコ","CCTV 포코","POCO CCTV","CCTV-POCO","MONITOROWANY POCO","POCO ALERTA","ПОКО С ВИДЕОЗАПИСИ","โปโค่ นักร้องมาริอาชิ","CCTV POCO","POCO CCTV"
"TID_CCTV_POCO_SKIN_SHOP","CCTV POCO","بوكو من كاميرا المراقبة","星妙实录波克","監視器畫面","CCTV\nPOCO","POCO\nSALA DE VIDEOVIGILANCIA","VALVONTAKAMERA-\nPOCO","POCO\nVIDÉOSURVEILLANCE","פוקו במעגל סגור","POCO CCTV","POCHO CCTV","CCTV\nポコ","CCTV 포코","POCO CCTV","CCTV-POCO","MONITOROWANY POCO","POCO\nALERTA","ПОКО С ВИДЕОЗАПИСИ","โปโค่ นักร้องมาริอาชิ","CCTV POCO","POCO\nCCTV"
