"TID","EN","AR","CN","CNT","DE","ES","FI","FR","HE","ID","IT","JP","KR","MS","NL","PL","PT","RU","TH","TR","VI"
"TID_PIRATE_BIBI_SKIN_SHOP","CURSED PIRATE\nBIBI","بيبي\nالقرصانة الملعونة","秘咒船长比比","魔咒船長","VERFLUCHTE PIRATIN\nBIBI","BIBI\nPIRATA MALDITA","KIROTTU MERIROSVO\n-BIBI","BIBI\nPIRATE MAUDITE","באבל\nהפיראט המקולל","BIBI\nBAJAK LAUT TERKUTUK","BIBI\nPIRATA MALEDETTA","幽霊船長\nビビ","언데드 해적 비비","BIBI\nLANUN DISUMPAH","VERVLOEKTE\nPIRAAT BIBI","PRZEKLĘTA\nPIRATKA BIBI","BIBI\nPIRATA AMALDIÇOADA","ЗОМБИ-ПИРАТКА\nБИБИ","บีบี\nโจรสลัดต้องสาป","LANETLİ KORSAN\nBIBI","BIBI\nCƯỚP BIỂN BỊ NGUYỀN RỦA"
"TID_INBOX_GEAR_REIMBURSEMENT","The way Gears work changed while you were away. All your Gears have been reset. Purchase new Gears with COINS. All your Gear Tokens and scrap you collected previously have been converted to <NUM> COINS.","تغيرت آلية عمل العتاد أثناء غيابك، أعدنا ضبط كل عتادك. اشتر عتادًا جديدًا بالنقود. تم تحويل كل أقراص العتاد والخردة التي جمعتها إلى <NUM> من النقود.","您退出游戏的时候，我们对强化装备的机制做了一些改动。您的所有强化装备现已重置，新版强化装备需使用金币购买。您之前获得的全部装备零件和装备碎片现已转化为<NUM>金币。","你離開遊戲期間，我們對強化裝置的機制做了一些改動。你的所有強化裝置現已重置，新版強化裝置需使用金幣購買。你之前獲得的全部裝置代幣和神奇碎片現已轉化為<NUM>金幣。","Während du weg warst, hat sich die Funktionsweise von Ausrüstungen geändert. Alle deine Ausrüstungen wurden zurückgesetzt. Neue Ausrüstungen kannst du mit MÜNZEN kaufen. Alle deine Ausrüstungsmarken und -fragmente wurden in <NUM> MÜNZEN umgewandelt.","El funcionamiento de los refuerzos ha cambiado mientras no estabas y se han reiniciado todos. Compra refuerzos nuevos con monedas. Todas las fichas de refuerzo y la chatarra que tenías se han convertido en <NUM> monedas.","Tehostimien toimintatapa muuttui sillä välin, kun olit poissa. Kaikki tehostimesi on nollattu, ja voit ostaa uusia tehostimia kolikoilla. Kaikki aiemmin keräämäsi tehostinpoletit ja osat on muunnettu <NUM> KOLIKOKSI.","Les équipements ont changé pendant votre absence. Ils ont tous été réinitialisés. Achetez de nouveaux équipements avec des pièces. Tous vos jetons et votre ferraille ont été convertis. Vous avez reçu <NUM> pièces.","תפקוד ה'ציוד' השתנה בהיעדרותך. כל פרטי הציוד שלך אופסו. יש לרכוש פרטי ציוד חדשים באמצעות מטבעות. כל טוקני הציוד והגרוטאות שאספת בעבר הומרו ל<NUM>מטבעות.","Cara kerja Buster berubah saat kamu pergi. Semua Buster telah direset. Beli Buster baru dengan KOIN. Semua Fragmen dan Token Buster yang telah kamu kumpulkan sebelumnya telah dikonversi menjadi <NUM> KOIN.","Abbiamo apportato delle modifiche agli equipaggiamenti mentre non eri in gioco, perciò abbiamo reimpostato tutti quelli che avevi. Ora puoi acquistare nuovi equipaggiamenti con le MONETE. Abbiamo convertito in <NUM> monete tutti i gettoni equipaggiamento e i frammenti che possedevi.","ギアの仕様が変更され、既存のギアはすべてリセットされました。コインで新しいギアを購入しましょう。お持ちのギアトークンとギアスクラップは<NUM>コインに変換されました。","자리를 비우신 동안 기어의 작동 방식이 바뀌었습니다. 이에 따라 보유한 모든 기어가 초기화되었으며, 코인으로 새로운 기어를 구매할 수 있습니다. 이전에 모은 기어 토큰과 스크랩이 코인 <NUM>개로 전환되었습니다.","Cara pelengkap berfungsi telah berubah semasa anda tiada. Semua pelengkap anda telah diset semula. Membeli pelengkap baharu dengan SYILING. Semua token pelengkap dan sekerap dikumpul sebelum ini telah ditukar kepada <NUM> SYILING.","We hebben wijzigingen aangebracht aan de uitrustingen terwijl je weg was. Al je uitrustingen zijn gereset. Koop nieuwe uitrustingen met MUNTEN. Al je verzamelde uitrustingstokens en schroot zijn omgezet in <NUM> MUNTEN.","System wyposażenia zmienił się pod twoją nieobecność. Całe twoje wyposażenie zostało zresetowane. Kup nowe za MONETY. Wszystkie twoje żetony wyposażenia i cały zebrany złom zostały zamienione na <NUM> szt. MONET.","O funcionamento das engrenagens mudou na sua ausência. Todas as engrenagens foram zeradas. Compre engrenagens novas com MOEDAS. Todas as fichas de engrenagem e sucatas que você tinha foram convertidas em <NUM> MOEDAS.","Пока тебя не было, принцип работы снаряжения изменился. Всё твоё снаряжение было сброшено. Приобрести новое можно за МОНЕТЫ. Все собранные тобой ранее жетоны снаряжения и детали превратились в МОНЕТЫ (<NUM>).","เครื่องมือได้เปลี่ยนรูปแบบการทำงานตอนคุณไม่อยู่ เครื่องมือทั้งหมดได้รับการรีเซ็ต ซื้อเครื่องมือใหม่ด้วยเหรียญ โทเค็นเครื่องมือและเศษเครื่องมือทั้งหมดที่คุณสะสมมาก่อนหน้านี้ได้ถูกเปลี่ยนเป็นเหรียญ <NUM> เหรียญ","Sen yokken eşyalar değişti. Tüm eşyaların sıfırlandı. Altın kullanarak yeni eşyalar alabilirsin. Önceden topladığın tüm eşya jetonları ve parçalar <NUM> altına dönüştürüldü.","Cách hoạt động của Trang bị đã được thay đổi khi bạn không có ở đây. Tất cả số Trang bị của bạn đã được đặt lại. Hãy mua Trang bị mới bằng XU. Tất cả Thẻ Trang bị và mảnh vụn bạn đã thu thập trước đó đã được chuyển đổi thành <NUM> XU."
"TID_INBOX_BLING_REIMBURSEMENT","Bling is a new way to unlock cosmetics. All your Star Points have been automatically converted to <NUM> Bling!","أقراص البلينج وسيلة جديدة لفتح الملحقات الجمالية. تم تحويل كل نقاط النجوم لديك تلقائيًا إلى <NUM> من أقراص البلينج.","闪闪币是一种解锁个性装扮的全新方式。您的星光点数已被自动转化为<NUM>闪闪币！","閃光幣是解鎖外觀的全新方式。你的星徽點數已被自動轉化為<NUM>閃光幣！","Bling ist ein neuer Weg, Design-Items freizuschalten. Alle deine Starpunkte wurden automatisch in <NUM> Bling umgewandelt!","Los blines son una nueva manera de desbloquear personalizaciones. Todos tus puntos estelares se han convertido automáticamente en <NUM> blines.","Bling on uusi tapa avata ehostuksia. Kaikki tähtipisteesi on automaattisesti muunnettu <NUM> blingiksi!","Les blings sont une nouvelle manière de débloquer des cosmétiques. Tous vos points Star ont été convertis. Vous avez reçu <NUM> blings !","בלינג הוא הדרך חדשה לפתיחת נעילה של אביזרים. כל נקודות הכוכב שלך הומרו אוטומטית ל<NUM>בלינג!","Bling adalah cara baru untuk membuka kosmetik. Semua Poin Bintang secara otomatis telah dikonversi menjadi <NUM> Bling!","I bling sono la nuova risorsa con cui sbloccare le personalizzazioni del gioco. Tutti i punti stellari che possedevi sono stati convertiti automaticamente in <NUM> bling!","新しいゲーム内通貨となるジュエルチップは、カスタマイズアイテムの購入に使用します。お持ちのスターポイントは自動的に<NUM>ジュエルチップに変換されました。","이제 블링으로 꾸미기 아이템을 잠금 해제할 수 있습니다. 기존에 보유한 모든 스타 포인트가 블링 <NUM>개로 자동 전환되었습니다.","Bling ialah cara baharu untuk membuka kosmetik. Semua mata bintang anda telah ditukar kepada <NUM> bling secara automatik.","Bling is een nieuwe manier waarmee je cosmetische items kunt ontgrendelen. Al je sterpunten zijn automatisch omgezet in <NUM> bling!","Błyskotki są nową walutą do zakupu przedmiotów kosmetycznych. Twoje gwiezdne punkty zostały zamienione na <NUM> szt. błyskotek!","Bling é a nova forma de liberar personalizações. Todos os pontos estelares foram convertidos em <NUM> blings!","Блинги — это новый способ покупать элементы оформления. Все твои звёздные очки были автоматически конвертированы в блинги (<NUM>).","เหรียญวิบวับคือวิธีใหม่ในการปลดล็อคไอเท็มความสวยงาม ค่าดวงดาวทั้งหมดของคุณได้ถูกเปลี่ยนเป็นเหรียญวิบวับ <NUM> เหรียญแล้ว","Mücevher, görsel ürünler açmak için kullanabileceğin yeni kaynağımızdır. Tüm yıldız puanların otomatik olarak <NUM> mücevhere dönüştürüldü!","Xu Bling là phương thức mới để mở khóa các phụ kiện thẩm mỹ. Tất cả số Điểm Sao của bạn đã tự động được chuyển đổi thành <NUM> Xu Bling!"
"TID_RANDOM_REWARD_INFO_DESCRIPTION","A surprise reward in each Drop!","مفاجأة في كل مكافأة!","每份星妙惊喜中都有超赞奖励！","每顆寶物之星中都有驚喜獎勵！","Eine Überraschungsbelohnung in jedem Drop!","¡Una recompensa sorpresa en cada premio!","Yllätyspalkinto joka dropilla!","Une récompense surprise dans chaque prix !","פרס בהפתעה בכל מטען!","Tiap Hadiah Starr berisi kejutan!","Ogni premio Starr contiene una sorpresa!","各スタードロップにサプライズ報酬！","깜짝 보상이 들어 있으니 놓치지 마세요!","Kejutan dalam setiap ganjaran!","Elke Drop bevat een verrassingsbeloning!","Nagroda-niespodzianka w każdym dropie!","Uma recompensa surpresa a cada sorteio!","Награда-сюрприз в каждом призе!","รางวัลสุดเซอร์ไพรส์ในการดรอปแต่ละครั้ง!","Her Starr hediyesinde sürpriz bir ödül var!","Mỗi phần thưởng đều có điều bất ngờ dành cho bạn!"
"TID_BATTLE_END_CC_SHOWER","CHROMA SHOWER EVENT","حدث جمع أرصدة الألوان","流光溢彩活动","星虹紛呈活動","CHROMAREGEN-EREIGNIS","LLUVIA DE CRÉDITOS CROMÁTICOS","KROMAATTINEN SADE -TAPAHTUMA","PLUIE DE CRÉDITS CHROMATIQUES","אירוע גשם של כרומה","ACARA HUJAN KROMA","EVENTO \qPIOGGIA CROMATICA\q","クロマの雨イベント","크로마 샤워 이벤트","ACARA HUJAN KROMA","CHROMAREGENEVENEMENT","WYDARZENIE: CHROMATYCZNY DESZCZ","CHUVA DE VALES CROMÁTICOS","СОБЫТИЕ С ХРОМАЛАВИНОЙ","อีเวนท์เครดิตโครม่าโปรยปราย","KROMA YAĞMURU ETKİNLİĞİ","SỰ KIỆN CƠN MƯA PHIẾU SẮC MÀU"
"TID_PAYLOAD_17","Transfer of Troubles","تناقل المشكلات","问题转移","轉移麻煩","Turbulenter Transport","Traspaso de problemas","Ongelmien siirto","Transfert d'ennuis","העברת צרות","Transfer Bahaya","Patata bollente","トラブル宅配便","트러블 트랜스퍼","Pemindahan Gangguan","Turbulente transport","Nowe kłopoty","Distribuindo problemas","Несчастный груз","ส่งต่อสารพันปัญหา","Dertlere Derman","Chuyển giao rắc rối"
"TID_FOOTBALL_BONNIE_SKIN","FOOTBONNIE","بوني الهدّافة","足球邦妮","足球小將","FUSSBALL BONNIE","BONNIEPIÉ","JALKKIS-BONNIE","FOOTBONNIE","פוטבוני","BONNIE BOLA","BONNIE CAPOCANNONIERA","サッカー ボニー","볼보니","BONNIE BOLA SEPAK","VOETBAL-BONNIE","PIŁKARSKA BONNIE","BONNIE CRAQUE","ФУТБОННИ","ฟุตบอนนี่","TOPÇU BONNIE","BONNIE BÓNG ĐÁ"
"TID_FOOTBALL_BONNIE_SKIN_SHOP","FOOTBONNIE","بوني الهدّافة","足球邦妮","足球小將","FUSSBALL\nBONNIE","BONNIEPIÉ","JALKKIS-\nBONNIE","FOOTBONNIE","פוטבוני","BONNIE BOLA","BONNIE CAPOCANNONIERA","サッカー\nボニー","볼보니","BONNIE\nBOLA SEPAK","VOETBAL-\nBONNIE","PIŁKARSKA BONNIE","BONNIE\nCRAQUE","ФУТБОННИ","ฟุตบอนนี่","TOPÇU BONNIE","BONNIE\nBÓNG ĐÁ"
"TID_GAME_MODE_3_DESC","Collect Stars for your team by defeating players on the enemy team. Every time you defeat an enemy, the bounty on your head increases by one Star, up to seven Stars. Don't give them to the enemy!\n\nThe team that collects 20 stars first or has more Stars when the clock runs out wins. In the case of a tie, the team holding the blue star wins.","اجمع النجوم لصالح فريقك بهزيمة أعضاء الفريق الخصم. تزداد المكافأة على رأسك بنجمة واحدة في كل مرة تهزم فيها عدوًا، وقد تصل إلى 7 نجوم. لا تدع العدو يستولي عليها.\n\nيفوز الفريق الذي يجمع 20 نجمة أو يحتفظ بأعلى عدد من النجوم عند نفاد الوقت. في حال وقوع تعادل، سيفوز الفريق الذي بحوزته النجمة الزرقاء.","击败对方英雄，为自己的队伍赢得赏金之星。您每击败一名对方英雄，头顶的赏金之星就会增加1颗，最多7颗。保护好您的赏金之星，可别让敌人给抢走了！\n\n率先收集到20颗赏金之星，或时间结束时赏金之星数量更多的一方，将会赢得对战。如果双方星数相同，则持有蓝色赏金之星的一方获胜。","擊敗敵方英雄，為自己的隊伍贏得賞金之星。你每擊敗一名敵方英雄，頭頂的賞金之星就會增加1顆，最多7顆。保護好你的賞金之星，別讓敵人搶走了！\n\n率先收集到20顆賞金之星，或對戰時間結束時獲得更多賞金之星的一方贏得對戰。如果雙方賞金之星數量相同，則持有藍色賞金之星的一方獲得勝利。","Sammle Sterne für dein Team, indem du Gegner besiegst. Jedes Mal, wenn du einen Gegner besiegst, erhöht sich das auf dich ausgesetzte Kopfgeld um einen Stern. So kannst du bis zu sieben Sterne für das gegnerische Team wert sein - lass dich nicht erwischen!\n\nDas Team, das zuerst 20 Sterne oder nach Ablauf der Zeit die meisten Sterne gesammelt hat, gewinnt. Bei einem Unentschieden gewinnt das Team, das den blauen Stern hat.","Derrota a los jugadores del equipo contrario para obtener estrellas para tu equipo. Cada vez que elimines a un jugador, conseguirás una estrella. Podrás tener hasta siete estrellas. ¡Que no te las quiten!\n\nEl equipo que consiga 20 estrellas o tenga más cuando el tiempo se acabe ganará el combate. Si se produce un empate, el equipo que tenga la estrella azul ganará.","Kerää joukkueellesi tähtiä päihittämällä vastustajajoukkueen pelaajia. Joka kerta, kun päihität vastustajan, pääsi päällä näkyvään palkkioon lisätään yksi tähti. Tähtiä voi olla jopa seitsemän - älä luovuta omiasi vastustajalle!\n\nVoittaja on joukkue, joka kerää ensimmäisenä 20 tähteä tai jolla on enemmän tähtiä ajan päättyessä. Tasapelitilanteessa voittaa se joukkue, jolla on sininen tähti.","Récupérez des étoiles en éliminant vos adversaires. À chaque ennemi vaincu, la prime sur votre tête monte d'une étoile et ce, jusqu'à sept. Ne les donnez pas à l'ennemi !\n\nL'équipe ayant gagné 20 étoiles, ou le plus d'étoiles possible à la fin du temps imparti remporte la victoire. En cas d'égalité, c'est l'équipe avec l'étoile bleue qui gagne.","יש לצבור כוכבים עבור הקבוצה שלך באמצעות הבסת השחקנים שבקבוצה היריבה. בכל פעם שאויב מובס על ידך, הפרס על ראשך עולה בכוכב אחד, עד שבעה כוכבים. זהירות - לא לתת אותם לאויב!\n\nהקבוצה הראשונה שצוברת 20 כוכבים או שברשותה יותר כוכבים כשהזמן נגמר, היא הקבוצה המנצחת. במקרה של תיקו, מנצחת הקבוצה שבידה הכוכב הכחול.","Kumpulkan Bintang untuk timmu dengan menumbangkan Jagoan tim lawan. Setiap kali kamu menumbangkan lawan, nilai buronanmu bertambah satu Bintang hingga maksimal tujuh. Jangan sampai tumbang!\n\nTim pertama yang meraih 20 Bintang atau tim dengan Bintang paling banyak saat waktu habis akan menang. Bintang Biru akan menjadi penentu hasil seri!","Raccogli le stelle per la squadra eliminando gli avversari. Guadagnerai una stella per ogni nemico sconfitto, per un massimo di sette stelle. Tienitele strette!\n\nVince la squadra che colleziona per prima 20 stelle o che ne possiede il maggior numero allo scadere del tempo. Nel caso di un pareggio, vince la squadra che ha la stella blu.","敵チームのプレイヤーを倒して星を集めよう。敵を倒すたびに、プレイヤーの頭上に表示される賞金の星が1つずつ、最大7つまで増える。敵チームに自分の星を奪われないよう、全力で生き延びよう！\n\n終了時に相手より先に星を20個集めたチーム、または相手より星が多いチームが勝利！引き分けの場合は、青い星を持っているチームが勝利する！","상대 팀 멤버를 처치하고 별을 모으세요! 상대를 처치할 때마다 자신의 머리 위에 별이 1개씩 추가되며, 최대 7개까지 모을 수 있습니다. 처치되면 별을 잃게 되니 조심하세요!\n\n별 20개를 먼저 모으거나 제한 시간 안에 더 많은 별을 모은 팀이 승리합니다! 무승부인 경우 파란색 별을 가진 팀이 승리합니다.","Kumpul bintang untuk pasukan anda dengan mengalahkan pemain pasukan musuh. Setiap kali anda mengalahkan seorang musuh, satu bintang akan bertambah di atas kepala anda sehingga mencapai tujuh bintang. Jangan serahkannya kepada musuh!\n\nPasukan yang mengumpul 20 bintang dahulu atau mempunyai lebih banyak bintang apabila masa tamat akan menang. Jika seri, pasukan yang memegang bintang biru akan menang.","Verzamel sterren voor je team door spelers van het vijandelijke team te verslaan. Elke keer dat je een vijand verslaat, wordt de premie op je hoofd verhoogt met één ster, met een maximum van zeven sterren. Geef ze niet aan de vijand!\n\nHet team dat als eerste 20 sterren verzamelt of de meeste sterren heeft als de tijd voorbij is, wint. Bij een gelijkspel wint het team dat de blauwe ster heeft.","Zbieraj gwiazdki dla swojej drużyny, pokonując graczy drużyny przeciwnej. Za każdym razem gdy pokonasz wroga, wyznaczona za ciebie nagroda zwiększy się o jedną gwiazdkę (maks. do siedmiu gwiazdek). Nie pozwól, żeby wpadły w ręce wroga!\n\nWygrywa drużyna, która pierwsza zbierze 20 gwiazdek lub będzie miała ich więcej, gdy skończy się czas. W razie remisu zwycięża drużyna z niebieską gwiazdką.","Junte estrelas para sua equipe ao derrotar jogadores da equipe inimiga. Sempre que você derrotar um inimigo, uma estrela aparecerá acima do seu personagem, até o máximo de sete. Não deixe o inimigo pegá-las!\n\nVence a equipe que alcançar 20 estrelas ou que tiver mais estrelas quando o tempo terminar. Caso haja empate, a equipe com a estrela azul vence.","Собирай звёзды для команды, побеждая участников команды врага. С каждой победой награда за твою голову будет увеличиваться на одну звезду, пока не достигнет семи звёзд. Не дай врагу отобрать их!\n\nПобеждает команда, первой собравшая 20 звёзд или больше звёзд по истечении времени. В случае ничьей побеждает команда, захватившая синюю звезду.","สะสมดาวให้กับทีมของคุณด้วยการกำจัดผู้เล่นของทีมศัตรู ทุกครั้งที่คุณกำจัดศัตรูหนึ่งคน ดาวค่าหัวบนหัวของคุณจะเพิ่มขึ้นหนึ่งดวง โดยจะมีได้สูงสุดเจ็ดดวง อย่าพลาดท่าให้ศัตรูเชียว!\n\nทีมที่เก็บดาวได้ 20 ดวงก่อนหรือมีดาวมากกว่าเมื่อหมดเวลาจะเป็นฝ่ายชนะ ในกรณีที่เสมอ ทีมที่มีดาวสีฟ้าจะเป็นฝ่ายชนะ","Düşman takımındaki oyuncuları yok ederek takımın için yıldız topla. Yok ettiğin her düşman için başındaki ödül bir yıldız artar ve yedi yıldıza kadar çıkar. Yıldızlarını düşmana kaptırma!\n\n20 yıldıza ilk ulaşan veya süre bittiğinde daha çok yıldıza sahip olan takım kazanır. Beraberlik durumunda mavi yıldıza sahip olan takım kazanır.","Thu thập Sao cho đội của bạn bằng cách hạ gục người chơi bên đội đối phương. Mỗi khi bạn tiêu diệt một kẻ địch, giá trị thưởng trên đầu bạn sẽ tăng thêm một Sao, tối đa là bảy Sao. Đừng để đối phương cướp được Sao của bạn!\n\nĐội nào thu thập được 20 Sao trước hoặc có nhiều Sao hơn khi đồng hồ báo hết giờ sẽ giành chiến thắng. Nếu hai đội có số Sao bằng nhau thì đội nào có ngôi sao màu xanh sẽ chiến thắng."
"TID_PAYLOAD_16","Midlands","الأراضي الوسطى","中部地区","中部地區","Mittelländer","Tierras medias","Sisämaat","Terres du milieu","מידלנדס","Bumi Tengah","Terre di mezzo","ミッドランズ","미들랜드","Bahagian Tengah","Middenland","Środkowe Lądy","Região central","Срединные земли","มิดแลนด์","İç Taraflar","Vùng trung du"
"TID_PAYLOAD_19","Iron Center","المركز الحديدي","钢铁中心","鋼鐵中心","Eisernes Zentrum","Centro férreo","Rautainen keskus","Centre ferré","מרכז ברזל","Inti Besi","Centro di ferro","アイアンセンター","아이언 센터","Pusat Besi","IJzeren centrum","Żelazny środek","Centro de ferro","Железное ядро","ใจกลางเหล็กกล้า","Demir Çekirdek","Trung tâm sắt"
"TID_BRAWL_PASS_QUESTS_CLAIM_TR_REWARDS","Claim Trophy Road rewards to unlock Quests!","طالب بمكافآت مسار الكؤوس لفتح المهام.","领取荣誉之路奖励以解锁任务！","領取榮耀之路獎勵以解鎖任務！","Fordere Trophäenpfad-Belohnungen ein, um Quests freizuschalten!","¡Consigue recompensas de trofeos para desbloquear misiones!","Avaa tehtävät lunastamalla palkinnot pokaalipolulta!","Débloquez les quêtes sur la voie des trophées !","קבלו פרסים מצבירת הגביעים כדי לפתוח נעילת קווסטים!","Klaim Hadiah Ambang Trofi untuk membuka Tugas!","Ritira i premi del Cammino dei trofei per sbloccare le missioni!","トロフィー目標報酬を回収してクエストをアンロックしましょう！","트로피 진척도 보상을 받아 퀘스트를 잠금 해제하세요!","Ambil ganjaran kemajuan trofi untuk buka misi!","Haal trofeeënpadbeloningen op om opdrachten te ontgrendelen!","Odbierz nagrody Alei Pucharów, aby odblokować misje!","Resgate as recompensas para desbloquear as missões!","Получай награды пути к славе, чтобы разблокировать квесты!","รับรางวัลจากถนนถ้วยรางวัลเพื่อปลดล็อคเควสต์!","Görevleri açmak için kupa yolu ödüllerini toplamalısın!","Nhận phần thưởng Cột mốc Cúp để mở khóa Nhiệm vụ!"
"TID_SHARK_MEG_SKIN","MEGALODON","ميج القرش","巨齿鲨梅格","深海巨齒鯊","MEGALODON","MEGALODÓN","MEGALODON","MEGALODON","מגלודון","MEGALODON","MEGALODONTE","メグロドン","메갈로돈 메그","MEGALODON","MEGALODON","MEGALODON","MEG ALODONTE","МЭГАЛОДОН","เม็กกาโลดอน","MEGALODON","MEG CÁ MẬP"
"TID_SHARK_MEG__SKIN_SHOP","MEGALODON","ميج القرش","巨齿鲨梅格","深海巨齒鯊","MEGALODON","MEGALODÓN","MEGALODON","MEGALODON","מגלודון","MEGALODON","MEGALODONTE","メグロドン","메갈로돈 메그","MEGALODON","MEGALODON","MEGALODON","MEG\nALODONTE","МЭГАЛОДОН","เม็กกาโลดอน","MEGALODON","MEG\nCÁ MẬP"
